<?xml version="1.0" encoding="UTF-8"?>
<xs:schema xmlns:xs="http://www.w3.org/2001/XMLSchema">

    <xs:element name="school">
        <xs:complexType>
            <xs:sequence>
                <xs:element name="student" maxOccurs="unbounded">
                    <xs:complexType>
                        <xs:sequence>
                            <xs:element name="name" type="xs:string" />
                            <xs:element name="date" type="xs:date" />
                        </xs:sequence>
                        <xs:attribute name="id" type="xs:string" use="required" />
                        <xs:attribute name="email" type="xs:string" use="required" />
                    </xs:complexType>
                </xs:element>
            </xs:sequence>
        </xs:complexType>

        <!-- Ràng buộc email phải duy nhất trong school -->
        <xs:unique name="UniqueStudentEmail">
            <xs:selector xpath="student" />
            <xs:field xpath="@email" />
        </xs:unique>

    </xs:element>

</xs:schema>